cantica;canto;cum_verse_number;verse_number;text;author
1;26;3573;140;a la quarta levar la poppa in suso;dante
1;26;3574;141;e la prora ire in giù, com’altrui piacque,;dante
1;26;3575;142;"infin che ’l mar fu sovra noi richiuso"".";dante
1;27;3576;1;Già era dritta in sù la fiamma e queta;dante
1;27;3577;2;per non dir più, e già da noi sen gia;dante
1;27;3578;3;con la licenza del dolce poeta,;dante
1;27;3579;4;quand’un’altra, che dietro a lei venìa,;dante
1;27;3580;5;ne fece volger li occhi a la sua cima;dante
1;27;3581;6;per un confuso suon che fuor n’uscia.;dante
1;27;3582;7;Come ’l bue cicilian che mugghiò prima;dante
1;27;3583;8;col pianto di colui, e ciò fu dritto,;dante
1;27;3584;9;che l’avea temperato con sua lima,;dante
1;27;3585;10;mugghiava con la voce de l’afflitto,;dante
1;27;3586;11;sì che, con tutto che fosse di rame,;dante
1;27;3587;12;"pur el pareva dal dolor trafitto;";dante
1;27;3588;13;così, per non aver via né forame;dante
1;27;3589;14;dal principio nel foco, in suo linguaggio;dante
1;27;3590;15;si convertïan le parole grame.;dante
1;27;3591;16;Ma poscia ch’ebber colto lor vïaggio;dante
1;27;3592;17;su per la punta, dandole quel guizzo;dante
1;27;3593;18;che dato avea la lingua in lor passaggio,;dante
1;27;3594;19;"udimmo dire: ""O tu a cu’ io drizzo";dante
1;27;3595;20;la voce e che parlavi mo lombardo,;dante
1;27;3596;21;"dicendo ""Istra ten va, più non t’adizzo"",";dante
1;27;3597;22;perch’io sia giunto forse alquanto tardo,;dante
1;27;3598;23;"non t’incresca restare a parlar meco;";dante
1;27;3599;24;vedi che non incresce a me, e ardo!;dante
1;27;3600;25;Se tu pur mo in questo mondo cieco;dante
1;27;3601;26;caduto se’ di quella dolce terra;dante
1;27;3602;27;latina ond’io mia colpa tutta reco,;dante
1;27;3603;28;"dimmi se Romagnuoli han pace o guerra;";dante
1;27;3604;29;ch’io fui d’i monti là intra Orbino;dante
1;27;3605;30;"e ’l giogo di che Tever si diserra"".";dante
1;27;3606;31;Io era in giuso ancora attento e chino,;dante
1;27;3607;32;quando il mio duca mi tentò di costa,;dante
1;27;3608;33;"dicendo: ""Parla tu; questi è latino"".";dante
1;27;3609;34;E io, ch’avea già pronta la risposta,;dante
1;27;3610;35;sanza indugio a parlare incominciai:;dante
1;27;3611;36;"""O anima che se’ là giù nascosta,";dante
1;27;3612;37;Romagna tua non è, e non fu mai,;dante
1;27;3613;38;"sanza guerra ne’ cuor de’ suoi tiranni;";dante
1;27;3614;39;ma ’n palese nessuna or vi lasciai.;dante
1;27;3615;40;Ravenna sta come stata è molt’anni:;dante
1;27;3616;41;l’aguglia da Polenta la si cova,;dante
1;27;3617;42;sì che Cervia ricuopre co’ suoi vanni.;dante
1;27;3618;43;La terra che fé già la lunga prova;dante
1;27;3619;44;e di Franceschi sanguinoso mucchio,;dante
1;27;3620;45;sotto le branche verdi si ritrova.;dante
1;27;3621;46;E ’l mastin vecchio e ’l nuovo da Verrucchio,;dante
1;27;3622;47;che fecer di Montagna il mal governo,;dante
1;27;3623;48;là dove soglion fan d’i denti succhio.;dante
1;27;3624;49;Le città di Lamone e di Santerno;dante
1;27;3625;50;conduce il lïoncel dal nido bianco,;dante
1;27;3626;51;che muta parte da la state al verno.;dante
1;27;3627;52;E quella cu' il Savio bagna il fianco,;dante
1;27;3628;53;così com'ella sie' tra 'l piano e 'l monte,;dante
1;27;3629;54;tra tirannia si vive e stato franco.}};dante
1;27;3630;55;"Ora chi se’, ti priego che ne conte;";dante
1;27;3631;56;non esser duro più ch’altri sia stato,;dante
1;27;3632;57;"se ’l nome tuo nel mondo tegna fronte"".";dante
1;27;3633;58;Poscia che ’l foco alquanto ebbe rugghiato;dante
1;27;3634;59;al modo suo, l’aguta punta mosse;dante
1;27;3635;60;di qua, di là, e poi diè cotal fiato:;dante
1;27;3636;61;"""S’i’ credesse che mia risposta fosse";dante
1;27;3637;62;a persona che mai tornasse al mondo,;dante
1;27;3638;63;"questa fiamma staria sanza più scosse;";dante
1;27;3639;64;ma però che già mai di questo fondo;dante
1;27;3640;65;non tornò vivo alcun, s’i’ odo il vero,;dante
1;27;3641;66;sanza tema d’infamia ti rispondo.;dante
1;27;3642;67;Io fui uom d'arme, e poi fui cordigliero,;dante
1;27;3643;68;"credendomi, sì cinto, fare ammenda;";dante
1;27;3644;69;e certo il creder mio venìa intero,;dante
1;27;3645;70;se non fosse il gran prete, a cui mal prenda!}},;dante
1;27;3646;71;"che mi rimise ne le prime colpe;";dante
1;27;3647;72;e come e quare, voglio che m’intenda.;dante
1;27;3648;73;Mentre ch’io forma fui d’ossa e di polpe;dante
1;27;3649;74;che la madre mi diè, l’opere mie;dante
1;27;3650;75;non furon leonine, ma di volpe.;dante
1;27;3651;76;Li accorgimenti e le coperte vie;dante
1;27;3652;77;io seppi tutte, e sì menai lor arte,;dante
1;27;3653;78;ch’al fine de la terra il suono uscie.;dante
1;27;3654;79;Quando mi vidi giunto in quella parte;dante
1;27;3655;80;di mia etade ove ciascun dovrebbe;dante
1;27;3656;81;calar le vele e raccoglier le sarte,;dante
1;27;3657;82;ciò che pria mi piacëa, allor m’increbbe,;dante
1;27;3658;83;"e pentuto e confesso mi rendei;";dante
1;27;3659;84;ahi miser lasso! e giovato sarebbe.;dante
1;27;3660;85;Lo principe d’i novi Farisei,;dante
1;27;3661;86;avendo guerra presso a Laterano,;dante
1;27;3662;87;e non con Saracin né con Giudei,;dante
1;27;3663;88;ché ciascun suo nimico era cristiano,;dante
1;27;3664;89;e nessun era stato a vincer Acri;dante
1;27;3665;90;né mercatante in terra di Soldano,;dante
1;27;3666;91;né sommo officio né ordini sacri;dante
1;27;3667;92;guardò in sé, né in me quel capestro;dante
1;27;3668;93;che solea fare i suoi cinti più macri.;dante
1;27;3669;94;Ma come Costantin chiese Silvestro;dante
1;27;3670;95;d’entro Siratti a guerir de la lebbre,;dante
1;27;3671;96;così mi chiese questi per maestro;dante
1;27;3672;97;"a guerir de la sua superba febbre;";dante
1;27;3673;98;domandommi consiglio, e io tacetti;dante
1;27;3674;99;perché le sue parole parver ebbre.;dante
1;27;3675;100;"E’ poi ridisse: ""Tuo cuor non sospetti;";dante
1;27;3676;101;finor t’assolvo, e tu m’insegna fare;dante
1;27;3677;102;sì come Penestrino in terra getti.;dante
1;27;3678;103;Lo ciel poss’io serrare e diserrare,;dante
1;27;3679;104;"come tu sai; però son due le chiavi";dante
1;27;3680;105;"che ’l mio antecessor non ebbe care"".";dante
1;27;3681;106;Allor mi pinser li argomenti gravi;dante
1;27;3682;107;là ’ve ’l tacer mi fu avviso ’l peggio,;dante
1;27;3683;108;"e dissi: ""Padre, da che tu mi lavi";dante
1;27;3684;109;di quel peccato ov’io mo cader deggio,;dante
1;27;3685;110;lunga promessa con l’attender corto;dante
1;27;3686;111;"ti farà trïunfar ne l’alto seggio"".";dante
1;27;3687;112;Francesco venne poi, com’io fu’ morto,;dante
1;27;3688;113;"per me; ma un d’i neri cherubini";dante
1;27;3689;114;"li disse: ""Non portar; non mi far torto.";dante
1;27;3690;115;Venir se ne dee giù tra ’ miei meschini;dante
1;27;3691;116;perché diede ’l consiglio frodolente,;dante
1;27;3692;117;"dal quale in qua stato li sono a’ crini;";dante
1;27;3693;118;ch'assolver non si può chi non si pente,;dante
1;27;3694;119;né pentere e volere insieme puossi;dante
1;27;3695;120;"per la contradizion che nol consente}}"".";dante
1;27;3696;121;Oh me dolente! come mi riscossi;dante
1;27;3697;122;"quando mi prese dicendomi: ""Forse";dante
1;27;3698;123;"tu non pensavi ch’io löico fossi!"".";dante
1;27;3699;124;"A Minòs mi portò; e quelli attorse";dante
1;27;3700;125;"otto volte la coda al dosso duro;";dante
1;27;3701;126;e poi che per gran rabbia la si morse,;dante
1;27;3702;127;"disse: ""Questi è d’i rei del foco furo"";";dante
1;27;3703;128;per ch’io là dove vedi son perduto,;dante
1;27;3704;129;"e sì vestito, andando, mi rancuro"".";dante
1;27;3705;130;Quand’elli ebbe ’l suo dir così compiuto,;dante
1;27;3706;131;la fiamma dolorando si partio,;dante
1;27;3707;132;torcendo e dibattendo ’l corno aguto.;dante
1;27;3708;133;Noi passamm’oltre, e io e ’l duca mio,;dante
1;27;3709;134;su per lo scoglio infino in su l’altr’arco;dante
1;27;3710;135;che cuopre ’l fosso in che si paga il fio;dante
1;27;3711;136;a quei che scommettendo acquistan carco.;dante
1;28;3712;1;Chi poria mai pur con parole sciolte;dante
1;28;3713;2;dicer del sangue e de le piaghe a pieno;dante
1;28;3714;3;ch’i’ ora vidi, per narrar più volte?;dante
1;28;3715;4;Ogne lingua per certo verria meno;dante
1;28;3716;5;per lo nostro sermone e per la mente;dante
1;28;3717;6;c’ hanno a tanto comprender poco seno.;dante
1;28;3718;7;S’el s’aunasse ancor tutta la gente;dante
1;28;3719;8;che già, in su la fortunata terra;dante
1;28;3720;9;di Puglia, fu del suo sangue dolente;dante
1;28;3721;10;per li Troiani e per la lunga guerra;dante
1;28;3722;11;che de l’anella fé sì alte spoglie,;dante
1;28;3723;12;come Livïo scrive, che non erra,;dante
1;28;3724;13;con quella che sentio di colpi doglie;dante
1;28;3725;14;"per contastare a Ruberto Guiscardo;";dante
1;28;3726;15;e l’altra il cui ossame ancor s’accoglie;dante
1;28;3727;16;a Ceperan, là dove fu bugiardo;dante
1;28;3728;17;ciascun Pugliese, e là da Tagliacozzo,;dante
1;28;3729;18;"dove sanz’arme vinse il vecchio Alardo;";dante
1;28;3730;19;e qual forato suo membro e qual mozzo;dante
1;28;3731;20;mostrasse, d’aequar sarebbe nulla;dante
1;28;3732;21;il modo de la nona bolgia sozzo.;dante
1;28;3733;22;Già veggia, per mezzul perdere o lulla,;dante
1;28;3734;23;com’io vidi un, così non si pertugia,;dante
1;28;3735;24;rotto dal mento infin dove si trulla.;dante
1;28;3736;25;"Tra le gambe pendevan le minugia;";dante
1;28;3737;26;la corata pareva e ’l tristo sacco;dante
1;28;3738;27;che merda fa di quel che si trangugia.;dante
1;28;3739;28;Mentre che tutto in lui veder m'attacco,;dante
1;28;3740;29;guardommi e con le man s'aperse il petto,;dante
1;28;3741;30;"dicendo: ""Or vedi com'io mi dilacco!";dante
1;28;3742;31;vedi come storpiato è Mäometto!}};dante
1;28;3743;32;Dinanzi a me sen va piangendo Alì,;dante
1;28;3744;33;fesso nel volto dal mento al ciuffetto.;dante
1;28;3745;34;E tutti li altri che tu vedi qui,;dante
1;28;3746;35;seminator di scandalo e di scisma;dante
1;28;3747;36;fuor vivi, e però son fessi così.;dante
1;28;3748;37;Un diavolo è qua dietro che n’accisma;dante
1;28;3749;38;sì crudelmente, al taglio de la spada;dante
1;28;3750;39;rimettendo ciascun di questa risma,;dante
1;28;3751;40;"quand’avem volta la dolente strada;";dante
1;28;3752;41;però che le ferite son richiuse;dante
1;28;3753;42;prima ch’altri dinanzi li rivada.;dante
1;28;3754;43;Ma tu chi se’ che ’n su lo scoglio muse,;dante
1;28;3755;44;forse per indugiar d’ire a la pena;dante
1;28;3756;45;"ch’è giudicata in su le tue accuse?"".";dante
1;28;3757;46;"""Né morte ’l giunse ancor, né colpa ’l mena"",";dante
1;28;3758;47;"rispuose ’l mio maestro, ""a tormentarlo;";dante
1;28;3759;48;ma per dar lui esperïenza piena,;dante
1;28;3760;49;a me, che morto son, convien menarlo;dante
1;28;3761;50;"per lo ’nferno qua giù di giro in giro;";dante
1;28;3762;51;"e quest’è ver così com’io ti parlo"".";dante
1;28;3763;52;Più fuor di cento che, quando l’udiro,;dante
1;28;3764;53;s’arrestaron nel fosso a riguardarmi;dante
1;28;3765;54;per maraviglia, oblïando il martiro.;dante
1;28;3766;55;"""Or dì a fra Dolcin dunque che s’armi,";dante
1;28;3767;56;tu che forse vedra’ il sole in breve,;dante
1;28;3768;57;s’ello non vuol qui tosto seguitarmi,;dante
1;28;3769;58;sì di vivanda, che stretta di neve;dante
1;28;3770;59;non rechi la vittoria al Noarese,;dante
1;28;3771;60;"ch’altrimenti acquistar non saria leve"".";dante
1;28;3772;61;Poi che l’un piè per girsene sospese,;dante
1;28;3773;62;"Mäometto mi disse esta parola;";dante
1;28;3774;63;indi a partirsi in terra lo distese.;dante
1;28;3775;64;Un altro, che forata avea la gola;dante
1;28;3776;65;e tronco ’l naso infin sotto le ciglia,;dante
1;28;3777;66;e non avea mai ch’una orecchia sola,;dante
1;28;3778;67;ristato a riguardar per maraviglia;dante
1;28;3779;68;con li altri, innanzi a li altri aprì la canna,;dante
1;28;3780;69;ch’era di fuor d’ogne parte vermiglia,;dante
1;28;3781;70;"e disse: ""O tu cui colpa non condanna";dante
1;28;3782;71;e cu’ io vidi in su terra latina,;dante
1;28;3783;72;se troppa simiglianza non m’inganna,;dante
1;28;3784;73;rimembriti di Pier da Medicina,;dante
1;28;3785;74;se mai torni a veder lo dolce piano;dante
1;28;3786;75;che da Vercelli a Marcabò dichina.;dante
1;28;3787;76;E fa sapere a’ due miglior da Fano,;dante
1;28;3788;77;a messer Guido e anco ad Angiolello,;dante
1;28;3789;78;che, se l’antiveder qui non è vano,;dante
1;28;3790;79;gittati saran fuor di lor vasello;dante
1;28;3791;80;e mazzerati presso a la Cattolica;dante
1;28;3792;81;per tradimento d’un tiranno fello.;dante
1;28;3793;82;Tra l’isola di Cipri e di Maiolica;dante
1;28;3794;83;non vide mai sì gran fallo Nettuno,;dante
1;28;3795;84;non da pirate, non da gente argolica.;dante
1;28;3796;85;Quel traditor che vede pur con l’uno,;dante
1;28;3797;86;e tien la terra che tale qui meco;dante
1;28;3798;87;vorrebbe di vedere esser digiuno,;dante
1;28;3799;88;"farà venirli a parlamento seco;";dante
1;28;3800;89;poi farà sì, ch’al vento di Focara;dante
1;28;3801;90;"non sarà lor mestier voto né preco"".";dante
1;28;3802;91;"E io a lui: ""Dimostrami e dichiara,";dante
1;28;3803;92;se vuo’ ch’i’ porti sù di te novella,;dante
1;28;3804;93;"chi è colui da la veduta amara"".";dante
1;28;3805;94;Allor puose la mano a la mascella;dante
1;28;3806;95;d’un suo compagno e la bocca li aperse,;dante
1;28;3807;96;"gridando: ""Questi è desso, e non favella.";dante
1;28;3808;97;Questi, scacciato, il dubitar sommerse;dante
1;28;3809;98;in Cesare, affermando che ’l fornito;dante
1;28;3810;99;"sempre con danno l’attender sofferse"".";dante
1;28;3811;100;Oh quanto mi pareva sbigottito;dante
1;28;3812;101;con la lingua tagliata ne la strozza;dante
1;28;3813;102;Curïo, ch’a dir fu così ardito!;dante
1;28;3814;103;E un ch’avea l’una e l’altra man mozza,;dante
1;28;3815;104;levando i moncherin per l’aura fosca,;dante
1;28;3816;105;sì che ’l sangue facea la faccia sozza,;dante
1;28;3817;106;"gridò: ""Ricordera’ ti anche del Mosca,";dante
1;28;3818;107;che disse, lasso!, ’Capo ha cosa fatta’,;dante
1;28;3819;108;"che fu mal seme per la gente tosca"".";dante
1;28;3820;109;"E io li aggiunsi: ""E morte di tua schiatta"";";dante
1;28;3821;110;per ch’elli, accumulando duol con duolo,;dante
1;28;3822;111;sen gio come persona trista e matta.;dante
1;28;3823;112;Ma io rimasi a riguardar lo stuolo,;dante
1;28;3824;113;e vidi cosa ch’io avrei paura,;dante
1;28;3825;114;"sanza più prova, di contarla solo;";dante
1;28;3826;115;se non che coscïenza m'assicura,;dante
1;28;3827;116;la buona compagnia che l'uom francheggia;dante
1;28;3828;117;sotto l'asbergo del sentirsi pura.}};dante
1;28;3829;118;Io vidi certo, e ancor par ch’io ’l veggia,;dante
1;28;3830;119;un busto sanza capo andar sì come;dante
1;28;3831;120;"andavan li altri de la trista greggia;";dante
1;28;3832;121;e ’l capo tronco tenea per le chiome,;dante
1;28;3833;122;pesol con mano a guisa di lanterna:;dante
1;28;3834;123;"e quel mirava noi e dicea: ""Oh me!"".";dante
1;28;3835;124;Di sé facea a sé stesso lucerna,;dante
1;28;3836;125;"ed eran due in uno e uno in due;";dante
1;28;3837;126;com’esser può, quei sa che sì governa.;dante
1;28;3838;127;Quando diritto al piè del ponte fue,;dante
1;28;3839;128;levò ’l braccio alto con tutta la testa;dante
1;28;3840;129;per appressarne le parole sue,;dante
1;28;3841;130;"che fuoro: ""Or vedi la pena molesta,";dante
1;28;3842;131;tu che, spirando, vai veggendo i morti:;dante
1;28;3843;132;vedi s’alcuna è grande come questa.;dante
1;28;3844;133;E perché tu di me novella porti,;dante
1;28;3845;134;sappi ch’i’ son Bertram dal Bornio, quelli;dante
1;28;3846;135;che diedi al re giovane i ma’ conforti.;dante
1;28;3847;136;"Io feci il padre e ’l figlio in sé ribelli;";dante
1;28;3848;137;Achitofèl non fé più d’Absalone;dante
1;28;3849;138;e di Davìd coi malvagi punzelli.;dante
1;28;3850;139;Perch’io parti’ così giunte persone,;dante
1;28;3851;140;partito porto il mio cerebro, lasso!,;dante
1;28;3852;141;dal suo principio ch’è in questo troncone.;dante
1;28;3853;142;"Così s’osserva in me lo contrapasso"".";dante
1;29;3854;1;La molta gente e le diverse piaghe;dante
1;29;3855;2;avean le luci mie sì inebrïate,;dante
1;29;3856;3;che de lo stare a piangere eran vaghe.;dante
1;29;3857;4;"Ma Virgilio mi disse: ""Che pur guate?";dante
1;29;3858;5;perché la vista tua pur si soffolge;dante
1;29;3859;6;là giù tra l’ombre triste smozzicate?;dante
1;29;3860;7;"Tu non hai fatto sì a l’altre bolge;";dante
1;29;3861;8;pensa, se tu annoverar le credi,;dante
1;29;3862;9;che miglia ventidue la valle volge.;dante
1;29;3863;10;"E già la luna è sotto i nostri piedi;";dante
1;29;3864;11;lo tempo è poco omai che n’è concesso,;dante
1;29;3865;12;"e altro è da veder che tu non vedi"".";dante
1;29;3866;13;"""Se tu avessi"", rispuos’io appresso,";dante
1;29;3867;14;"""atteso a la cagion per ch’io guardava,";dante
1;29;3868;15;"forse m’avresti ancor lo star dimesso"".";dante
1;29;3869;16;Parte sen giva, e io retro li andava,;dante
1;29;3870;17;lo duca, già faccendo la risposta,;dante
1;29;3871;18;"e soggiugnendo: ""Dentro a quella cava";dante
1;29;3872;19;dov’io tenea or li occhi sì a posta,;dante
1;29;3873;20;credo ch’un spirto del mio sangue pianga;dante
1;29;3874;21;"la colpa che là giù cotanto costa"".";dante
1;29;3875;22;"Allor disse ’l maestro: ""Non si franga";dante
1;29;3876;23;lo tuo pensier da qui innanzi sovr’ello.;dante
1;29;3877;24;"Attendi ad altro, ed ei là si rimanga;";dante
1;29;3878;25;ch’io vidi lui a piè del ponticello;dante
1;29;3879;26;mostrarti e minacciar forte col dito,;dante
1;29;3880;27;e udi’ ’l nominar Geri del Bello.;dante
1;29;3881;28;Tu eri allor sì del tutto impedito;dante
1;29;3882;29;sovra colui che già tenne Altaforte,;dante
1;29;3883;30;"che non guardasti in là, sì fu partito"".";dante
1;29;3884;31;"""O duca mio, la vïolenta morte";dante
1;29;3885;32;"che non li è vendicata ancor"", diss’io,";dante
1;29;3886;33;"""per alcun che de l’onta sia consorte,";dante
1;29;3887;34;"fece lui disdegnoso; ond’el sen gio";dante
1;29;3888;35;sanza parlarmi, sì com’ïo estimo:;dante
1;29;3889;36;"e in ciò m’ ha el fatto a sé più pio"".";dante
1;29;3890;37;Così parlammo infino al loco primo;dante
1;29;3891;38;che de lo scoglio l’altra valle mostra,;dante
1;29;3892;39;se più lume vi fosse, tutto ad imo.;dante
1;29;3893;40;Quando noi fummo sor l’ultima chiostra;dante
1;29;3894;41;di Malebolge, sì che i suoi conversi;dante
1;29;3895;42;potean parere a la veduta nostra,;dante
1;29;3896;43;lamenti saettaron me diversi,;dante
1;29;3897;44;"che di pietà ferrati avean li strali;";dante
1;29;3898;45;ond’io li orecchi con le man copersi.;dante
1;29;3899;46;Qual dolor fora, se de li spedali;dante
1;29;3900;47;di Valdichiana tra ’l luglio e ’l settembre;dante
1;29;3901;48;e di Maremma e di Sardigna i mali;dante
1;29;3902;49;fossero in una fossa tutti ’nsembre,;dante
1;29;3903;50;tal era quivi, e tal puzzo n’usciva;dante
1;29;3904;51;qual suol venir de le marcite membre.;dante
1;29;3905;52;Noi discendemmo in su l’ultima riva;dante
1;29;3906;53;"del lungo scoglio, pur da man sinistra;";dante
1;29;3907;54;e allor fu la mia vista più viva;dante
1;29;3908;55;giù ver’ lo fondo, là ’ve la ministra;dante
1;29;3909;56;de l’alto Sire infallibil giustizia;dante
1;29;3910;57;punisce i falsador che qui registra.;dante
1;29;3911;58;Non credo ch’a veder maggior tristizia;dante
1;29;3912;59;fosse in Egina il popol tutto infermo,;dante
1;29;3913;60;quando fu l’aere sì pien di malizia,;dante
1;29;3914;61;che li animali, infino al picciol vermo,;dante
1;29;3915;62;cascaron tutti, e poi le genti antiche,;dante
1;29;3916;63;secondo che i poeti hanno per fermo,;dante
1;29;3917;64;"si ristorar di seme di formiche;";dante
1;29;3918;65;ch’era a veder per quella oscura valle;dante
1;29;3919;66;languir li spirti per diverse biche.;dante
1;29;3920;67;Qual sovra ’l ventre e qual sovra le spalle;dante
1;29;3921;68;l’un de l’altro giacea, e qual carpone;dante
1;29;3922;69;si trasmutava per lo tristo calle.;dante
1;29;3923;70;Passo passo andavam sanza sermone,;dante
1;29;3924;71;guardando e ascoltando li ammalati,;dante
1;29;3925;72;che non potean levar le lor persone.;dante
1;29;3926;73;Io vidi due sedere a sé poggiati,;dante
1;29;3927;74;com’a scaldar si poggia tegghia a tegghia,;dante
1;29;3928;75;"dal capo al piè di schianze macolati;";dante
1;29;3929;76;e non vidi già mai menare stregghia;dante
1;29;3930;77;a ragazzo aspettato dal segnorso,;dante
1;29;3931;78;né a colui che mal volontier vegghia,;dante
1;29;3932;79;come ciascun menava spesso il morso;dante
1;29;3933;80;de l’unghie sopra sé per la gran rabbia;dante
1;29;3934;81;"del pizzicor, che non ha più soccorso;";dante
1;29;3935;82;e sì traevan giù l’unghie la scabbia,;dante
1;29;3936;83;come coltel di scardova le scaglie;dante
1;29;3937;84;o d’altro pesce che più larghe l’abbia.;dante
1;29;3938;85;"""O tu che con le dita ti dismaglie"",";dante
1;29;3939;86;cominciò ’l duca mio a l’un di loro,;dante
1;29;3940;87;"""e che fai d’esse talvolta tanaglie,";dante
1;29;3941;88;dinne s’alcun Latino è tra costoro;dante
1;29;3942;89;che son quinc’entro, se l’unghia ti basti;dante
1;29;3943;90;"etternalmente a cotesto lavoro"".";dante
1;29;3944;91;"""Latin siam noi, che tu vedi sì guasti";dante
1;29;3945;92;"qui ambedue"", rispuose l’un piangendo;";dante
1;29;3946;93;"""ma tu chi se’ che di noi dimandasti?"".";dante
1;29;3947;94;"E ’l duca disse: ""I’ son un che discendo";dante
1;29;3948;95;con questo vivo giù di balzo in balzo,;dante
1;29;3949;96;"e di mostrar lo ’nferno a lui intendo"".";dante
1;29;3950;97;"Allor si ruppe lo comun rincalzo;";dante
1;29;3951;98;e tremando ciascuno a me si volse;dante
1;29;3952;99;con altri che l’udiron di rimbalzo.;dante
1;29;3953;100;Lo buon maestro a me tutto s’accolse,;dante
1;29;3954;101;"dicendo: ""Dì a lor ciò che tu vuoli"";";dante
1;29;3955;102;e io incominciai, poscia ch’ei volse:;dante
1;29;3956;103;"""Se la vostra memoria non s’imboli";dante
1;29;3957;104;nel primo mondo da l’umane menti,;dante
1;29;3958;105;ma s’ella viva sotto molti soli,;dante
1;29;3959;106;"ditemi chi voi siete e di che genti;";dante
1;29;3960;107;la vostra sconcia e fastidiosa pena;dante
1;29;3961;108;"di palesarvi a me non vi spaventi"".";dante
1;29;3962;109;"""Io fui d'Arezzo, e Albero da Siena"",";dante
1;29;3963;110;"rispuose l'un, ""mi fé mettere al foco;";dante
1;29;3964;111;ma quel per ch'io mori' qui non mi mena.}};dante
1;29;3965;112;Vero è ch’i’ dissi lui, parlando a gioco:;dante
1;29;3966;113;"""I’ mi saprei levar per l’aere a volo"";";dante
1;29;3967;114;e quei, ch’avea vaghezza e senno poco,;dante
1;29;3968;115;"volle ch’i’ li mostrassi l’arte; e solo";dante
1;29;3969;116;perch’io nol feci Dedalo, mi fece;dante
1;29;3970;117;ardere a tal che l’avea per figliuolo.;dante
1;29;3971;118;Ma ne l’ultima bolgia de le diece;dante
1;29;3972;119;me per l’alchìmia che nel mondo usai;dante
1;29;3973;120;"dannò Minòs, a cui fallar non lece"".";dante
1;29;3974;121;"E io dissi al poeta: ""Or fu già mai";dante
1;29;3975;122;gente sì vana come la sanese?;dante
1;29;3976;123;"Certo non la francesca sì d'assai!}}"".";dante
1;29;3977;124;Onde l’altro lebbroso, che m’intese,;dante
1;29;3978;125;"rispuose al detto mio: ""Tra’ mene Stricca";dante
1;29;3979;126;che seppe far le temperate spese,;dante
1;29;3980;127;e Niccolò che la costuma ricca;dante
1;29;3981;128;del garofano prima discoverse;dante
1;29;3982;129;"ne l’orto dove tal seme s’appicca;";dante
1;29;3983;130;e tra’ ne la brigata in che disperse;dante
1;29;3984;131;Caccia d’Ascian la vigna e la gran fonda,;dante
1;29;3985;132;e l’Abbagliato suo senno proferse.;dante
1;29;3986;133;Ma perché sappi chi sì ti seconda;dante
1;29;3987;134;contra i Sanesi, aguzza ver’ me l’occhio,;dante
1;29;3988;135;sì che la faccia mia ben ti risponda:;dante
1;29;3989;136;sì vedrai ch’io son l’ombra di Capocchio,;dante
1;29;3990;137;"che falsai li metalli con l’alchìmia;";dante
1;29;3991;138;e te dee ricordar, se ben t’adocchio,;dante
1;29;3992;139;"com’io fui di natura buona scimia"".";dante
1;30;3993;1;Nel tempo che Iunone era crucciata;dante
1;30;3994;2;per Semelè contra ’l sangue tebano,;dante
1;30;3995;3;come mostrò una e altra fïata,;dante
1;30;3996;4;Atamante divenne tanto insano,;dante
1;30;3997;5;che veggendo la moglie con due figli;dante
1;30;3998;6;andar carcata da ciascuna mano,;dante
1;30;3999;7;"gridò: ""Tendiam le reti, sì ch’io pigli";dante
1;30;4000;8;"la leonessa e ’ leoncini al varco"";";dante
1;30;4001;9;e poi distese i dispietati artigli,;dante
1;30;4002;10;prendendo l’un ch’avea nome Learco,;dante
1;30;4003;11;"e rotollo e percosselo ad un sasso;";dante
1;30;4004;12;e quella s’annegò con l’altro carco.;dante
1;30;4005;13;E quando la fortuna volse in basso;dante
1;30;4006;14;l’altezza de’ Troian che tutto ardiva,;dante
1;30;4007;15;sì che ’nsieme col regno il re fu casso,;dante
1;30;4008;16;Ecuba trista, misera e cattiva,;dante
1;30;4009;17;poscia che vide Polissena morta,;dante
1;30;4010;18;e del suo Polidoro in su la riva;dante
1;30;4011;19;del mar si fu la dolorosa accorta,;dante
1;30;4012;20;"forsennata latrò sì come cane;";dante
1;30;4013;21;tanto il dolor le fé la mente torta.;dante
1;30;4014;22;Ma né di Tebe furie né troiane;dante
1;30;4015;23;si vider mäi in alcun tanto crude,;dante
