cantica;canto;cum_verse_number;verse_number;text;author
2;17;7119;127;Ciascun confusamente un bene apprende;dante
2;17;7120;128;"nel qual si queti l'animo, e disira;";dante
2;17;7121;129;per che di giugner lui ciascun contende.}};dante
2;17;7122;130;Se lento amore a lui veder vi tira;dante
2;17;7123;131;o a lui acquistar, questa cornice,;dante
2;17;7124;132;dopo giusto penter, ve ne martira.;dante
2;17;7125;133;"Altro ben è che non fa l’uom felice;";dante
2;17;7126;134;non è felicità, non è la buona;dante
2;17;7127;135;essenza, d’ogne ben frutto e radice.;dante
2;17;7128;136;L’amor ch’ad esso troppo s’abbandona,;dante
2;17;7129;137;"di sovr’a noi si piange per tre cerchi;";dante
2;17;7130;138;ma come tripartito si ragiona,;dante
2;17;7131;139;"tacciolo, acciò che tu per te ne cerchi"".";dante
2;18;7132;1;Posto avea fine al suo ragionamento;dante
2;18;7133;2;l’alto dottore, e attento guardava;dante
2;18;7134;3;"ne la mia vista s’io parea contento;";dante
2;18;7135;4;e io, cui nova sete ancor frugava,;dante
2;18;7136;5;di fuor tacea, e dentro dicea: ’Forse;dante
2;18;7137;6;lo troppo dimandar ch’io fo li grava’.;dante
2;18;7138;7;Ma quel padre verace, che s’accorse;dante
2;18;7139;8;del timido voler che non s’apriva,;dante
2;18;7140;9;parlando, di parlare ardir mi porse.;dante
2;18;7141;10;"Ond’io: ""Maestro, il mio veder s’avviva";dante
2;18;7142;11;sì nel tuo lume, ch’io discerno chiaro;dante
2;18;7143;12;quanto la tua ragion parta o descriva.;dante
2;18;7144;13;Però ti prego, dolce padre caro,;dante
2;18;7145;14;che mi dimostri amore, a cui reduci;dante
2;18;7146;15;"ogne buono operare e ’l suo contraro"".";dante
2;18;7147;16;"""Drizza"", disse, ""ver’ me l’agute luci";dante
2;18;7148;17;de lo ’ntelletto, e fieti manifesto;dante
2;18;7149;18;l’error de’ ciechi che si fanno duci.;dante
2;18;7150;19;L’animo, ch’è creato ad amar presto,;dante
2;18;7151;20;ad ogne cosa è mobile che piace,;dante
2;18;7152;21;tosto che dal piacere in atto è desto.;dante
2;18;7153;22;Vostra apprensiva da esser verace;dante
2;18;7154;23;tragge intenzione, e dentro a voi la spiega,;dante
2;18;7155;24;"sì che l’animo ad essa volger face;";dante
2;18;7156;25;e se, rivolto, inver’ di lei si piega,;dante
2;18;7157;26;quel piegare è amor, quell’è natura;dante
2;18;7158;27;che per piacer di novo in voi si lega.;dante
2;18;7159;28;Poi, come ’l foco movesi in altura;dante
2;18;7160;29;per la sua forma ch’è nata a salire;dante
2;18;7161;30;là dove più in sua matera dura,;dante
2;18;7162;31;così l’animo preso entra in disire,;dante
2;18;7163;32;ch’è moto spiritale, e mai non posa;dante
2;18;7164;33;fin che la cosa amata il fa gioire.;dante
2;18;7165;34;Or ti puote apparer quant’è nascosa;dante
2;18;7166;35;la veritate a la gente ch’avvera;dante
2;18;7167;36;"ciascun amore in sé laudabil cosa;";dante
2;18;7168;37;però che forse appar la sua matera;dante
2;18;7169;38;sempre esser buona, ma non ciascun segno;dante
2;18;7170;39;"è buono, ancor che buona sia la cera"".";dante
2;18;7171;40;"""Le tue parole e ’l mio seguace ingegno"",";dante
2;18;7172;41;"rispuos’io lui, ""m’ hanno amor discoverto,";dante
2;18;7173;42;"ma ciò m’ ha fatto di dubbiar più pregno;";dante
2;18;7174;43;ché, s’amore è di fuori a noi offerto;dante
2;18;7175;44;e l’anima non va con altro piede,;dante
2;18;7176;45;"se dritta o torta va, non è suo merto"".";dante
2;18;7177;46;"Ed elli a me: ""Quanto ragion qui vede,";dante
2;18;7178;47;"dir ti poss’io; da indi in là t’aspetta";dante
2;18;7179;48;pur a Beatrice, ch’è opra di fede.;dante
2;18;7180;49;Ogne forma sustanzïal, che setta;dante
2;18;7181;50;è da matera ed è con lei unita,;dante
2;18;7182;51;specifica vertute ha in sé colletta,;dante
2;18;7183;52;la qual sanza operar non è sentita,;dante
2;18;7184;53;né si dimostra mai che per effetto,;dante
2;18;7185;54;come per verdi fronde in pianta vita.;dante
2;18;7186;55;Però, là onde vegna lo ’ntelletto;dante
2;18;7187;56;de le prime notizie, omo non sape,;dante
2;18;7188;57;e de’ primi appetibili l’affetto,;dante
2;18;7189;58;che sono in voi sì come studio in ape;dante
2;18;7190;59;"di far lo mele; e questa prima voglia";dante
2;18;7191;60;merto di lode o di biasmo non cape.;dante
2;18;7192;61;Or perché a questa ogn’altra si raccoglia,;dante
2;18;7193;62;innata v’è la virtù che consiglia,;dante
2;18;7194;63;e de l’assenso de’ tener la soglia.;dante
2;18;7195;64;Quest’è ’l principio là onde si piglia;dante
2;18;7196;65;ragion di meritare in voi, secondo;dante
2;18;7197;66;che buoni e rei amori accoglie e viglia.;dante
2;18;7198;67;Color che ragionando andaro al fondo,;dante
2;18;7199;68;"s’accorser d’esta innata libertate;";dante
2;18;7200;69;però moralità lasciaro al mondo.;dante
2;18;7201;70;Onde, poniam che di necessitate;dante
2;18;7202;71;surga ogne amor che dentro a voi s’accende,;dante
2;18;7203;72;di ritenerlo è in voi la podestate.;dante
2;18;7204;73;La nobile virtù Beatrice intende;dante
2;18;7205;74;per lo libero arbitrio, e però guarda;dante
2;18;7206;75;"che l’abbi a mente, s’a parlar ten prende"".";dante
2;18;7207;76;La luna, quasi a mezza notte tarda,;dante
2;18;7208;77;facea le stelle a noi parer più rade,;dante
2;18;7209;78;"fatta com’un secchion che tuttor arda;";dante
2;18;7210;79;e correa contra ’l ciel per quelle strade;dante
2;18;7211;80;che ’l sole infiamma allor che quel da Roma;dante
2;18;7212;81;tra ’ Sardi e ’ Corsi il vede quando cade.;dante
2;18;7213;82;E quell’ombra gentil per cui si noma;dante
2;18;7214;83;Pietola più che villa mantoana,;dante
2;18;7215;84;"del mio carcar diposta avea la soma;";dante
2;18;7216;85;per ch’io, che la ragione aperta e piana;dante
2;18;7217;86;sovra le mie quistioni avea ricolta,;dante
2;18;7218;87;stava com’om che sonnolento vana.;dante
2;18;7219;88;Ma questa sonnolenza mi fu tolta;dante
2;18;7220;89;subitamente da gente che dopo;dante
2;18;7221;90;le nostre spalle a noi era già volta.;dante
2;18;7222;91;E quale Ismeno già vide e Asopo;dante
2;18;7223;92;lungo di sé di notte furia e calca,;dante
2;18;7224;93;pur che i Teban di Bacco avesser uopo,;dante
2;18;7225;94;cotal per quel giron suo passo falca,;dante
2;18;7226;95;per quel ch’io vidi di color, venendo,;dante
2;18;7227;96;cui buon volere e giusto amor cavalca.;dante
2;18;7228;97;Tosto fur sovr’a noi, perché correndo;dante
2;18;7229;98;"si movea tutta quella turba magna;";dante
2;18;7230;99;e due dinanzi gridavan piangendo:;dante
2;18;7231;100;"""Maria corse con fretta a la montagna;";dante
2;18;7232;101;e Cesare, per soggiogare Ilerda,;dante
2;18;7233;102;"punse Marsilia e poi corse in Ispagna"".";dante
2;18;7234;103;"""Ratto, ratto, che ’l tempo non si perda";dante
2;18;7235;104;"per poco amor"", gridavan li altri appresso,";dante
2;18;7236;105;"""che studio di ben far grazia rinverda"".";dante
2;18;7237;106;"""O gente in cui fervore aguto adesso";dante
2;18;7238;107;ricompie forse negligenza e indugio;dante
2;18;7239;108;da voi per tepidezza in ben far messo,;dante
2;18;7240;109;questi che vive, e certo i’ non vi bugio,;dante
2;18;7241;110;"vuole andar sù, pur che ’l sol ne riluca;";dante
2;18;7242;111;"però ne dite ond’è presso il pertugio"".";dante
2;18;7243;112;"Parole furon queste del mio duca;";dante
2;18;7244;113;"e un di quelli spirti disse: ""Vieni";dante
2;18;7245;114;di retro a noi, e troverai la buca.;dante
2;18;7246;115;Noi siam di voglia a muoverci sì pieni,;dante
2;18;7247;116;"che restar non potem; però perdona,";dante
2;18;7248;117;se villania nostra giustizia tieni.;dante
2;18;7249;118;Io fui abate in San Zeno a Verona;dante
2;18;7250;119;sotto lo ’mperio del buon Barbarossa,;dante
2;18;7251;120;di cui dolente ancor Milan ragiona.;dante
2;18;7252;121;E tale ha già l’un piè dentro la fossa,;dante
2;18;7253;122;che tosto piangerà quel monastero,;dante
2;18;7254;123;"e tristo fia d’avere avuta possa;";dante
2;18;7255;124;perché suo figlio, mal del corpo intero,;dante
2;18;7256;125;e de la mente peggio, e che mal nacque,;dante
2;18;7257;126;"ha posto in loco di suo pastor vero"".";dante
2;18;7258;127;Io non so se più disse o s’ei si tacque,;dante
2;18;7259;128;"tant’era già di là da noi trascorso;";dante
2;18;7260;129;ma questo intesi, e ritener mi piacque.;dante
2;18;7261;130;E quei che m’era ad ogne uopo soccorso;dante
2;18;7262;131;"disse: ""Volgiti qua: vedine due";dante
2;18;7263;132;"venir dando a l’accidïa di morso"".";dante
2;18;7264;133;"Di retro a tutti dicean: ""Prima fue";dante
2;18;7265;134;morta la gente a cui il mar s’aperse,;dante
2;18;7266;135;che vedesse Iordan le rede sue.;dante
2;18;7267;136;E quella che l’affanno non sofferse;dante
2;18;7268;137;fino a la fine col figlio d’Anchise,;dante
2;18;7269;138;"sé stessa a vita sanza gloria offerse"".";dante
2;18;7270;139;Poi quando fuor da noi tanto divise;dante
2;18;7271;140;quell’ombre, che veder più non potiersi,;dante
2;18;7272;141;novo pensiero dentro a me si mise,;dante
2;18;7273;142;"del qual più altri nacquero e diversi;";dante
2;18;7274;143;e tanto d’uno in altro vaneggiai,;dante
2;18;7275;144;che li occhi per vaghezza ricopersi,;dante
2;18;7276;145;e ’l pensamento in sogno trasmutai.;dante
2;19;7277;1;Ne l’ora che non può ’l calor dïurno;dante
2;19;7278;2;intepidar più ’l freddo de la luna,;dante
2;19;7279;3;vinto da terra, e talor da Saturno;dante
2;19;7280;4;- quando i geomanti lor Maggior Fortuna;dante
2;19;7281;5;veggiono in orïente, innanzi a l’alba,;dante
2;19;7282;6;surger per via che poco le sta bruna -,;dante
2;19;7283;7;mi venne in sogno una femmina balba,;dante
2;19;7284;8;ne li occhi guercia, e sovra i piè distorta,;dante
2;19;7285;9;con le man monche, e di colore scialba.;dante
2;19;7286;10;"Io la mirava; e come ’l sol conforta";dante
2;19;7287;11;le fredde membra che la notte aggrava,;dante
2;19;7288;12;così lo sguardo mio le facea scorta;dante
2;19;7289;13;la lingua, e poscia tutta la drizzava;dante
2;19;7290;14;in poco d’ora, e lo smarrito volto,;dante
2;19;7291;15;com’amor vuol, così le colorava.;dante
2;19;7292;16;Poi ch’ell’avea ’l parlar così disciolto,;dante
2;19;7293;17;cominciava a cantar sì, che con pena;dante
2;19;7294;18;da lei avrei mio intento rivolto.;dante
2;19;7295;19;"""Io son"", cantava, ""io son dolce serena,";dante
2;19;7296;20;"che ’ marinari in mezzo mar dismago;";dante
2;19;7297;21;tanto son di piacere a sentir piena!;dante
2;19;7298;22;Io volsi Ulisse del suo cammin vago;dante
2;19;7299;23;"al canto mio; e qual meco s’ausa,";dante
2;19;7300;24;"rado sen parte; sì tutto l’appago!"".";dante
2;19;7301;25;Ancor non era sua bocca richiusa,;dante
2;19;7302;26;quand’una donna apparve santa e presta;dante
2;19;7303;27;lunghesso me per far colei confusa.;dante
2;19;7304;28;"""O Virgilio, Virgilio, chi è questa?"",";dante
2;19;7305;29;"fieramente dicea; ed el venìa";dante
2;19;7306;30;con li occhi fitti pur in quella onesta.;dante
2;19;7307;31;L’altra prendea, e dinanzi l’apria;dante
2;19;7308;32;"fendendo i drappi, e mostravami ’l ventre;";dante
2;19;7309;33;quel mi svegliò col puzzo che n’uscia.;dante
2;19;7310;34;"Io mossi li occhi, e ’l buon maestro: ""Almen tre";dante
2;19;7311;35;"voci t’ ho messe!"", dicea, ""Surgi e vieni;";dante
2;19;7312;36;"troviam l’aperta per la qual tu entre"".";dante
2;19;7313;37;Sù mi levai, e tutti eran già pieni;dante
2;19;7314;38;de l’alto dì i giron del sacro monte,;dante
2;19;7315;39;e andavam col sol novo a le reni.;dante
2;19;7316;40;Seguendo lui, portava la mia fronte;dante
2;19;7317;41;come colui che l’ ha di pensier carca,;dante
2;19;7318;42;"che fa di sé un mezzo arco di ponte;";dante
2;19;7319;43;"quand’io udi’ ""Venite; qui si varca""";dante
2;19;7320;44;parlare in modo soave e benigno,;dante
2;19;7321;45;qual non si sente in questa mortal marca.;dante
2;19;7322;46;Con l’ali aperte, che parean di cigno,;dante
2;19;7323;47;volseci in sù colui che sì parlonne;dante
2;19;7324;48;tra due pareti del duro macigno.;dante
2;19;7325;49;Mosse le penne poi e ventilonne,;dante
2;19;7326;50;’Qui lugent’affermando esser beati,;dante
2;19;7327;51;ch’avran di consolar l’anime donne.;dante
2;19;7328;52;"""Che hai che pur inver’ la terra guati?"",";dante
2;19;7329;53;la guida mia incominciò a dirmi,;dante
2;19;7330;54;poco amendue da l’angel sormontati.;dante
2;19;7331;55;"E io: ""Con tanta sospeccion fa irmi";dante
2;19;7332;56;novella visïon ch’a sé mi piega,;dante
2;19;7333;57;"sì ch’io non posso dal pensar partirmi"".";dante
2;19;7334;58;"""Vedesti"", disse, ""quell’antica strega";dante
2;19;7335;59;"che sola sovr’a noi omai si piagne;";dante
2;19;7336;60;vedesti come l’uom da lei si slega.;dante
2;19;7337;61;"Bastiti, e batti a terra le calcagne;";dante
2;19;7338;62;li occhi rivolgi al logoro che gira;dante
2;19;7339;63;"lo rege etterno con le rote magne"".";dante
2;19;7340;64;Quale ’l falcon, che prima a’ piè si mira,;dante
2;19;7341;65;indi si volge al grido e si protende;dante
2;19;7342;66;per lo disio del pasto che là il tira,;dante
2;19;7343;67;"tal mi fec’io; e tal, quanto si fende";dante
2;19;7344;68;la roccia per dar via a chi va suso,;dante
2;19;7345;69;n’andai infin dove ’l cerchiar si prende.;dante
2;19;7346;70;Com’io nel quinto giro fui dischiuso,;dante
2;19;7347;71;vidi gente per esso che piangea,;dante
2;19;7348;72;giacendo a terra tutta volta in giuso.;dante
2;19;7349;73;’Adhaesit pavimento anima mea’;dante
2;19;7350;74;sentia dir lor con sì alti sospiri,;dante
2;19;7351;75;che la parola a pena s’intendea.;dante
2;19;7352;76;"""O eletti di Dio, li cui soffriri";dante
2;19;7353;77;e giustizia e speranza fa men duri,;dante
2;19;7354;78;"drizzate noi verso li alti saliri"".";dante
2;19;7355;79;"""Se voi venite dal giacer sicuri,";dante
2;19;7356;80;e volete trovar la via più tosto,;dante
2;19;7357;81;"le vostre destre sien sempre di fori"".";dante
2;19;7358;82;Così pregò ’l poeta, e sì risposto;dante
2;19;7359;83;"poco dinanzi a noi ne fu; per ch’io";dante
2;19;7360;84;nel parlare avvisai l’altro nascosto,;dante
2;19;7361;85;e volsi li occhi a li occhi al segnor mio:;dante
2;19;7362;86;ond’elli m’assentì con lieto cenno;dante
2;19;7363;87;ciò che chiedea la vista del disio.;dante
2;19;7364;88;Poi ch’io potei di me fare a mio senno,;dante
2;19;7365;89;trassimi sovra quella creatura;dante
2;19;7366;90;le cui parole pria notar mi fenno,;dante
2;19;7367;91;"dicendo: ""Spirto in cui pianger matura";dante
2;19;7368;92;quel sanza ’l quale a Dio tornar non pòssi,;dante
2;19;7369;93;sosta un poco per me tua maggior cura.;dante
2;19;7370;94;Chi fosti e perché vòlti avete i dossi;dante
2;19;7371;95;al sù, mi dì, e se vuo’ ch’io t’impetri;dante
2;19;7372;96;"cosa di là ond’io vivendo mossi"".";dante
2;19;7373;97;"Ed elli a me: ""Perché i nostri diretri";dante
2;19;7374;98;"rivolga il cielo a sé, saprai; ma prima";dante
2;19;7375;99;scias quod ego fui successor Petri.;dante
2;19;7376;100;Intra Sïestri e Chiaveri s’adima;dante
2;19;7377;101;una fiumana bella, e del suo nome;dante
2;19;7378;102;lo titol del mio sangue fa sua cima.;dante
2;19;7379;103;Un mese e poco più prova’ io come;dante
2;19;7380;104;pesa il gran manto a chi dal fango il guarda,;dante
2;19;7381;105;che piuma sembran tutte l’altre some.;dante
2;19;7382;106;"La mia conversïone, omè!, fu tarda;";dante
2;19;7383;107;ma, come fatto fui roman pastore,;dante
2;19;7384;108;così scopersi la vita bugiarda.;dante
2;19;7385;109;Vidi che lì non s’acquetava il core,;dante
2;19;7386;110;"né più salir potiesi in quella vita;";dante
2;19;7387;111;per che di questa in me s’accese amore.;dante
2;19;7388;112;Fino a quel punto misera e partita;dante
2;19;7389;113;"da Dio anima fui, del tutto avara;";dante
2;19;7390;114;or, come vedi, qui ne son punita.}};dante
2;19;7391;115;Quel ch’avarizia fa, qui si dichiara;dante
2;19;7392;116;"in purgazion de l’anime converse;";dante
2;19;7393;117;e nulla pena il monte ha più amara.;dante
2;19;7394;118;Sì come l’occhio nostro non s’aderse;dante
2;19;7395;119;in alto, fisso a le cose terrene,;dante
2;19;7396;120;così giustizia qui a terra il merse.;dante
2;19;7397;121;Come avarizia spense a ciascun bene;dante
2;19;7398;122;lo nostro amore, onde operar perdési,;dante
2;19;7399;123;così giustizia qui stretti ne tene,;dante
2;19;7400;124;"ne’ piedi e ne le man legati e presi;";dante
2;19;7401;125;e quanto fia piacer del giusto Sire,;dante
2;19;7402;126;"tanto staremo immobili e distesi"".";dante
2;19;7403;127;"Io m’era inginocchiato e volea dire;";dante
2;19;7404;128;ma com’io cominciai ed el s’accorse,;dante
2;19;7405;129;solo ascoltando, del mio reverire,;dante
2;19;7406;130;"""Qual cagion"", disse, ""in giù così ti torse?"".";dante
2;19;7407;131;"E io a lui: ""Per vostra dignitate";dante
2;19;7408;132;"mia coscïenza dritto mi rimorse"".";dante
2;19;7409;133;"""Drizza le gambe, lèvati sù, frate!"",";dante
2;19;7410;134;"rispuose; ""non errar: conservo sono";dante
2;19;7411;135;teco e con li altri ad una podestate.;dante
2;19;7412;136;Se mai quel santo evangelico suono;dante
2;19;7413;137;che dice ’Neque nubent’intendesti,;dante
2;19;7414;138;ben puoi veder perch’io così ragiono.;dante
2;19;7415;139;"Vattene omai: non vo’ che più t’arresti;";dante
2;19;7416;140;ché la tua stanza mio pianger disagia,;dante
2;19;7417;141;col qual maturo ciò che tu dicesti.;dante
2;19;7418;142;Nepote ho io di là c’ ha nome Alagia,;dante
2;19;7419;143;buona da sé, pur che la nostra casa;dante
2;19;7420;144;"non faccia lei per essempro malvagia;";dante
2;19;7421;145;"e questa sola di là m’è rimasa"".";dante
2;20;7422;1;"Contra miglior voler voler mal pugna;";dante
2;20;7423;2;onde contra ’l piacer mio, per piacerli,;dante
2;20;7424;3;trassi de l’acqua non sazia la spugna.;dante
2;20;7425;4;"Mossimi; e ’l duca mio si mosse per li";dante
2;20;7426;5;luoghi spediti pur lungo la roccia,;dante
2;20;7427;6;"come si va per muro stretto a’ merli;";dante
2;20;7428;7;ché la gente che fonde a goccia a goccia;dante
2;20;7429;8;per li occhi il mal che tutto ’l mondo occupa,;dante
2;20;7430;9;da l’altra parte in fuor troppo s’approccia.;dante
2;20;7431;10;Maladetta sie tu, antica lupa,;dante
2;20;7432;11;che più che tutte l’altre bestie hai preda;dante
2;20;7433;12;per la tua fame sanza fine cupa!;dante
2;20;7434;13;O ciel, nel cui girar par che si creda;dante
2;20;7435;14;le condizion di qua giù trasmutarsi,;dante
2;20;7436;15;quando verrà per cui questa disceda?;dante
2;20;7437;16;Noi andavam con passi lenti e scarsi,;dante
2;20;7438;17;e io attento a l’ombre, ch’i’ sentia;dante
2;20;7439;18;"pietosamente piangere e lagnarsi;";dante
2;20;7440;19;"e per ventura udi’ ""Dolce Maria!""";dante
2;20;7441;20;dinanzi a noi chiamar così nel pianto;dante
2;20;7442;21;"come fa donna che in parturir sia;";dante
2;20;7443;22;"e seguitar: ""Povera fosti tanto,";dante
2;20;7444;23;quanto veder si può per quello ospizio;dante
2;20;7445;24;"dove sponesti il tuo portato santo"".";dante
2;20;7446;25;"Seguentemente intesi: ""O buon Fabrizio,";dante
2;20;7447;26;con povertà volesti anzi virtute;dante
2;20;7448;27;"che gran ricchezza posseder con vizio"".";dante
2;20;7449;28;Queste parole m’eran sì piaciute,;dante
2;20;7450;29;ch’io mi trassi oltre per aver contezza;dante
2;20;7451;30;di quello spirto onde parean venute.;dante
2;20;7452;31;Esso parlava ancor de la larghezza;dante
2;20;7453;32;che fece Niccolò a le pulcelle,;dante
2;20;7454;33;per condurre ad onor lor giovinezza.;dante
2;20;7455;34;"""O anima che tanto ben favelle,";dante
2;20;7456;35;"dimmi chi fosti"", dissi, ""e perché sola";dante
2;20;7457;36;tu queste degne lode rinovelle.;dante
2;20;7458;37;Non fia sanza mercé la tua parola,;dante
2;20;7459;38;s’io ritorno a compiér lo cammin corto;dante
2;20;7460;39;"di quella vita ch’al termine vola"".";dante
2;20;7461;40;"Ed elli: ""Io ti dirò, non per conforto";dante
2;20;7462;41;ch’io attenda di là, ma perché tanta;dante
2;20;7463;42;grazia in te luce prima che sie morto.;dante
2;20;7464;43;Io fui radice de la mala pianta;dante
2;20;7465;44;che la terra cristiana tutta aduggia,;dante
2;20;7466;45;sì che buon frutto rado se ne schianta.;dante
2;20;7467;46;Ma se Doagio, Lilla, Guanto e Bruggia;dante
2;20;7468;47;"potesser, tosto ne saria vendetta;";dante
2;20;7469;48;e io la cheggio a lui che tutto giuggia.;dante
2;20;7470;49;"Chiamato fui di là Ugo Ciappetta;";dante
2;20;7471;50;di me son nati i Filippi e i Luigi;dante
2;20;7472;51;per cui novellamente è Francia retta.;dante
2;20;7473;52;Figliuol fu’ io d’un beccaio di Parigi:;dante
2;20;7474;53;quando li regi antichi venner meno;dante
2;20;7475;54;tutti, fuor ch’un renduto in panni bigi,;dante
2;20;7476;55;trova’ mi stretto ne le mani il freno;dante
2;20;7477;56;del governo del regno, e tanta possa;dante
2;20;7478;57;di nuovo acquisto, e sì d’amici pieno,;dante
2;20;7479;58;ch’a la corona vedova promossa;dante
2;20;7480;59;la testa di mio figlio fu, dal quale;dante
2;20;7481;60;cominciar di costor le sacrate ossa.;dante
2;20;7482;61;Mentre che la gran dota provenzale;dante
2;20;7483;62;al sangue mio non tolse la vergogna,;dante
2;20;7484;63;poco valea, ma pur non facea male.;dante
2;20;7485;64;Lì cominciò con forza e con menzogna;dante
2;20;7486;65;"la sua rapina; e poscia, per ammenda,";dante
2;20;7487;66;Pontì e Normandia prese e Guascogna.;dante
2;20;7488;67;Carlo venne in Italia e, per ammenda,;dante
2;20;7489;68;"vittima fé di Curradino; e poi";dante
2;20;7490;69;ripinse al ciel Tommaso, per ammenda.;dante
2;20;7491;70;Tempo vegg’io, non molto dopo ancoi,;dante
2;20;7492;71;che tragge un altro Carlo fuor di Francia,;dante
2;20;7493;72;per far conoscer meglio e sé e ’ suoi.;dante
2;20;7494;73;Sanz’arme n’esce e solo con la lancia;dante
2;20;7495;74;con la qual giostrò Giuda, e quella ponta;dante
2;20;7496;75;sì, ch’a Fiorenza fa scoppiar la pancia.;dante
2;20;7497;76;Quindi non terra, ma peccato e onta;dante
2;20;7498;77;guadagnerà, per sé tanto più grave,;dante
2;20;7499;78;quanto più lieve simil danno conta.;dante
2;20;7500;79;L’altro, che già uscì preso di nave,;dante
2;20;7501;80;veggio vender sua figlia e patteggiarne;dante
2;20;7502;81;come fanno i corsar de l’altre schiave.;dante
2;20;7503;82;O avarizia, che puoi tu più farne,;dante
2;20;7504;83;poscia c’ ha’ il mio sangue a te sì tratto,;dante
2;20;7505;84;che non si cura de la propria carne?;dante
2;20;7506;85;Perché men paia il mal futuro e 'l fatto,;dante
2;20;7507;86;veggio in Alagna intrar lo fiordaliso,;dante
2;20;7508;87;e nel vicario suo Cristo esser catto.}};dante
2;20;7509;88;"Veggiolo un’altra volta esser deriso;";dante
2;20;7510;89;veggio rinovellar l’aceto e ’l fiele,;dante
2;20;7511;90;e tra vivi ladroni esser anciso.;dante
2;20;7512;91;Veggio il novo Pilato sì crudele,;dante
2;20;7513;92;che ciò nol sazia, ma sanza decreto;dante
2;20;7514;93;portar nel Tempio le cupide vele.;dante
2;20;7515;94;O Segnor mio, quando sarò io lieto;dante
2;20;7516;95;a veder la vendetta che, nascosa,;dante
2;20;7517;96;fa dolce l’ira tua nel tuo secreto?;dante
2;20;7518;97;Ciò ch’io dicea di quell’unica sposa;dante
2;20;7519;98;de lo Spirito Santo e che ti fece;dante
2;20;7520;99;verso me volger per alcuna chiosa,;dante
2;20;7521;100;tanto è risposto a tutte nostre prece;dante
2;20;7522;101;"quanto ’l dì dura; ma com’el s’annotta,";dante
2;20;7523;102;contrario suon prendemo in quella vece.;dante
2;20;7524;103;Noi repetiam Pigmalïon allotta,;dante
2;20;7525;104;cui traditore e ladro e paricida;dante
2;20;7526;105;"fece la voglia sua de l’oro ghiotta;";dante
2;20;7527;106;e la miseria de l’avaro Mida,;dante
2;20;7528;107;che seguì a la sua dimanda gorda,;dante
2;20;7529;108;per la qual sempre convien che si rida.;dante
2;20;7530;109;Del folle Acàn ciascun poi si ricorda,;dante
2;20;7531;110;come furò le spoglie, sì che l’ira;dante
2;20;7532;111;di Iosüè qui par ch’ancor lo morda.;dante
2;20;7533;112;"Indi accusiam col marito Saffira;";dante
2;20;7534;113;"lodiamo i calci ch’ebbe Elïodoro;";dante
2;20;7535;114;e in infamia tutto ’l monte gira;dante
2;20;7536;115;"Polinestòr ch’ancise Polidoro;";dante
2;20;7537;116;"ultimamente ci si grida: ""Crasso,";dante
2;20;7538;117;"dilci, che ’l sai: di che sapore è l’oro?"".";dante
2;20;7539;118;Talor parla l’uno alto e l’altro basso,;dante
2;20;7540;119;secondo l’affezion ch’ad ir ci sprona;dante
2;20;7541;120;ora a maggiore e ora a minor passo:;dante
2;20;7542;121;però al ben che ’l dì ci si ragiona,;dante
2;20;7543;122;"dianzi non era io sol; ma qui da presso";dante
2;20;7544;123;"non alzava la voce altra persona"".";dante
2;20;7545;124;Noi eravam partiti già da esso,;dante
2;20;7546;125;e brigavam di soverchiar la strada;dante
2;20;7547;126;tanto quanto al poder n’era permesso,;dante
2;20;7548;127;quand’io senti’, come cosa che cada,;dante
2;20;7549;128;"tremar lo monte; onde mi prese un gelo";dante
2;20;7550;129;qual prender suol colui ch’a morte vada.;dante
2;20;7551;130;Certo non si scoteo sì forte Delo,;dante
2;20;7552;131;pria che Latona in lei facesse ’l nido;dante
2;20;7553;132;a parturir li due occhi del cielo.;dante
2;20;7554;133;Poi cominciò da tutte parti un grido;dante
2;20;7555;134;tal, che ’l maestro inverso me si feo,;dante
2;20;7556;135;"dicendo: ""Non dubbiar, mentr’io ti guido"".";dante
2;20;7557;136;’Glorïa in excelsis’ tutti ’Deo’;dante
2;20;7558;137;dicean, per quel ch’io da’ vicin compresi,;dante
2;20;7559;138;onde intender lo grido si poteo.;dante
2;20;7560;139;No’ istavamo immobili e sospesi;dante
