cantica;canto;cum_verse_number;verse_number;text;author
3;6;10253;77;che, fuggendoli innanzi, dal colubro;dante
3;6;10254;78;la morte prese subitana e atra.;dante
3;6;10255;79;"Con costui corse infino al lito rubro;";dante
3;6;10256;80;con costui puose il mondo in tanta pace,;dante
3;6;10257;81;che fu serrato a Giano il suo delubro.;dante
3;6;10258;82;Ma ciò che ’l segno che parlar mi face;dante
3;6;10259;83;fatto avea prima e poi era fatturo;dante
3;6;10260;84;per lo regno mortal ch’a lui soggiace,;dante
3;6;10261;85;diventa in apparenza poco e scuro,;dante
3;6;10262;86;se in mano al terzo Cesare si mira;dante
3;6;10263;87;"con occhio chiaro e con affetto puro;";dante
3;6;10264;88;ché la viva giustizia che mi spira,;dante
3;6;10265;89;li concedette, in mano a quel ch’i’ dico,;dante
3;6;10266;90;gloria di far vendetta a la sua ira.;dante
3;6;10267;91;Or qui t’ammira in ciò ch’io ti replìco:;dante
3;6;10268;92;poscia con Tito a far vendetta corse;dante
3;6;10269;93;de la vendetta del peccato antico.;dante
3;6;10270;94;E quando il dente longobardo morse;dante
3;6;10271;95;la Santa Chiesa, sotto le sue ali;dante
3;6;10272;96;Carlo Magno, vincendo, la soccorse.;dante
3;6;10273;97;Omai puoi giudicar di quei cotali;dante
3;6;10274;98;ch’io accusai di sopra e di lor falli,;dante
3;6;10275;99;che son cagion di tutti vostri mali.;dante
3;6;10276;100;L’uno al pubblico segno i gigli gialli;dante
3;6;10277;101;oppone, e l’altro appropria quello a parte,;dante
3;6;10278;102;sì ch’è forte a veder chi più si falli.;dante
3;6;10279;103;Faccian li Ghibellin, faccian lor arte;dante
3;6;10280;104;sott’ altro segno, ché mal segue quello;dante
3;6;10281;105;"sempre chi la giustizia e lui diparte;";dante
3;6;10282;106;e non l’abbatta esto Carlo novello;dante
3;6;10283;107;coi Guelfi suoi, ma tema de li artigli;dante
3;6;10284;108;ch’a più alto leon trasser lo vello.;dante
3;6;10285;109;Molte fïate già pianser li figli;dante
3;6;10286;110;per la colpa del padre, e non si creda;dante
3;6;10287;111;che Dio trasmuti l’armi per suoi gigli!;dante
3;6;10288;112;Questa picciola stella si correda;dante
3;6;10289;113;d’i buoni spirti che son stati attivi;dante
3;6;10290;114;perché onore e fama li succeda:;dante
3;6;10291;115;e quando li disiri poggian quivi,;dante
3;6;10292;116;sì disvïando, pur convien che i raggi;dante
3;6;10293;117;del vero amore in sù poggin men vivi.;dante
3;6;10294;118;Ma nel commensurar d’i nostri gaggi;dante
3;6;10295;119;col merto è parte di nostra letizia,;dante
3;6;10296;120;perché non li vedem minor né maggi.;dante
3;6;10297;121;Quindi addolcisce la viva giustizia;dante
3;6;10298;122;in noi l’affetto sì, che non si puote;dante
3;6;10299;123;torcer già mai ad alcuna nequizia.;dante
3;6;10300;124;"Diverse voci fanno dolci note;";dante
3;6;10301;125;così diversi scanni in nostra vita;dante
3;6;10302;126;rendon dolce armonia tra queste rote.;dante
3;6;10303;127;E dentro a la presente margarita;dante
3;6;10304;128;luce la luce di Romeo, di cui;dante
3;6;10305;129;fu l’ovra grande e bella mal gradita.;dante
3;6;10306;130;Ma i Provenzai che fecer contra lui;dante
3;6;10307;131;"non hanno riso; e però mal cammina";dante
3;6;10308;132;qual si fa danno del ben fare altrui.;dante
3;6;10309;133;Quattro figlie ebbe, e ciascuna reina,;dante
3;6;10310;134;Ramondo Beringhiere, e ciò li fece;dante
3;6;10311;135;Romeo, persona umìle e peregrina.;dante
3;6;10312;136;E poi il mosser le parole biece;dante
3;6;10313;137;a dimandar ragione a questo giusto,;dante
3;6;10314;138;che li assegnò sette e cinque per diece,;dante
3;6;10315;139;"indi partissi povero e vetusto;";dante
3;6;10316;140;e se ’l mondo sapesse il cor ch’elli ebbe;dante
3;6;10317;141;mendicando sua vita a frusto a frusto,;dante
3;6;10318;142;assai lo loda, e più lo loderebbe».;dante
3;7;10319;1;«Osanna, sanctus Deus sabaòth,;dante
3;7;10320;2;superillustrans claritate tua;dante
3;7;10321;3;felices ignes horum malacòth!».;dante
3;7;10322;4;Così, volgendosi a la nota sua,;dante
3;7;10323;5;fu viso a me cantare essa sustanza,;dante
3;7;10324;6;"sopra la qual doppio lume s’addua;";dante
3;7;10325;7;ed essa e l’altre mossero a sua danza,;dante
3;7;10326;8;e quasi velocissime faville;dante
3;7;10327;9;mi si velar di sùbita distanza.;dante
3;7;10328;10;Io dubitava e dicea ’Dille, dille!’;dante
3;7;10329;11;fra me, ’dille’ dicea, ’a la mia donna;dante
3;7;10330;12;che mi diseta con le dolci stille’.;dante
3;7;10331;13;Ma quella reverenza che s’indonna;dante
3;7;10332;14;di tutto me, pur per Be e per ice,;dante
3;7;10333;15;mi richinava come l’uom ch’assonna.;dante
3;7;10334;16;Poco sofferse me cotal Beatrice;dante
3;7;10335;17;e cominciò, raggiandomi d’un riso;dante
3;7;10336;18;tal, che nel foco faria l’uom felice:;dante
3;7;10337;19;«Secondo mio infallibile avviso,;dante
3;7;10338;20;come giusta vendetta giustamente;dante
3;7;10339;21;"punita fosse, t’ha in pensier miso;";dante
3;7;10340;22;"ma io ti solverò tosto la mente;";dante
3;7;10341;23;e tu ascolta, ché le mie parole;dante
3;7;10342;24;di gran sentenza ti faran presente.;dante
3;7;10343;25;Per non soffrire a la virtù che vole;dante
3;7;10344;26;freno a suo prode, quell’ uom che non nacque,;dante
3;7;10345;27;"dannando sé, dannò tutta sua prole;";dante
3;7;10346;28;onde l’umana specie inferma giacque;dante
3;7;10347;29;giù per secoli molti in grande errore,;dante
3;7;10348;30;fin ch’al Verbo di Dio discender piacque;dante
3;7;10349;31;u’ la natura, che dal suo fattore;dante
3;7;10350;32;s’era allungata, unì a sé in persona;dante
3;7;10351;33;con l’atto sol del suo etterno amore.;dante
3;7;10352;34;Or drizza il viso a quel ch’or si ragiona:;dante
3;7;10353;35;questa natura al suo fattore unita,;dante
3;7;10354;36;"qual fu creata, fu sincera e buona;";dante
3;7;10355;37;ma per sé stessa pur fu ella sbandita;dante
3;7;10356;38;di paradiso, però che si torse;dante
3;7;10357;39;da via di verità e da sua vita.;dante
3;7;10358;40;La pena dunque che la croce porse;dante
3;7;10359;41;s’a la natura assunta si misura,;dante
3;7;10360;42;"nulla già mai sì giustamente morse;";dante
3;7;10361;43;e così nulla fu di tanta ingiura,;dante
3;7;10362;44;guardando a la persona che sofferse,;dante
3;7;10363;45;in che era contratta tal natura.;dante
3;7;10364;46;Però d’un atto uscir cose diverse:;dante
3;7;10365;47;"ch’a Dio e a’ Giudei piacque una morte;";dante
3;7;10366;48;per lei tremò la terra e ’l ciel s’aperse.;dante
3;7;10367;49;Non ti dee oramai parer più forte,;dante
3;7;10368;50;quando si dice che giusta vendetta;dante
3;7;10369;51;poscia vengiata fu da giusta corte.;dante
3;7;10370;52;Ma io veggi’ or la tua mente ristretta;dante
3;7;10371;53;di pensiero in pensier dentro ad un nodo,;dante
3;7;10372;54;del qual con gran disio solver s’aspetta.;dante
3;7;10373;55;"Tu dici: ""Ben discerno ciò ch’i’ odo;";dante
3;7;10374;56;ma perché Dio volesse, m’è occulto,;dante
3;7;10375;57;"a nostra redenzion pur questo modo"".";dante
3;7;10376;58;Questo decreto, frate, sta sepulto;dante
3;7;10377;59;a li occhi di ciascuno il cui ingegno;dante
3;7;10378;60;ne la fiamma d’amor non è adulto.;dante
3;7;10379;61;Veramente, però ch’a questo segno;dante
3;7;10380;62;molto si mira e poco si discerne,;dante
3;7;10381;63;dirò perché tal modo fu più degno.;dante
3;7;10382;64;La divina bontà, che da sé sperne;dante
3;7;10383;65;ogne livore, ardendo in sé, sfavilla;dante
3;7;10384;66;sì che dispiega le bellezze etterne.;dante
3;7;10385;67;Ciò che da lei sanza mezzo distilla;dante
3;7;10386;68;non ha poi fine, perché non si move;dante
3;7;10387;69;la sua imprenta quand’ ella sigilla.;dante
3;7;10388;70;Ciò che da essa sanza mezzo piove;dante
3;7;10389;71;libero è tutto, perché non soggiace;dante
3;7;10390;72;a la virtute de le cose nove.;dante
3;7;10391;73;"Più l’è conforme, e però più le piace;";dante
3;7;10392;74;ché l’ardor santo ch’ogne cosa raggia,;dante
3;7;10393;75;ne la più somigliante è più vivace.;dante
3;7;10394;76;Di tutte queste dote s’avvantaggia;dante
3;7;10395;77;l’umana creatura, e s’una manca,;dante
3;7;10396;78;di sua nobilità convien che caggia.;dante
3;7;10397;79;Solo il peccato è quel che la disfranca;dante
3;7;10398;80;e falla dissimìle al sommo bene,;dante
3;7;10399;81;"per che del lume suo poco s’imbianca;";dante
3;7;10400;82;e in sua dignità mai non rivene,;dante
3;7;10401;83;se non rïempie, dove colpa vòta,;dante
3;7;10402;84;contra mal dilettar con giuste pene.;dante
3;7;10403;85;Vostra natura, quando peccò tota;dante
3;7;10404;86;nel seme suo, da queste dignitadi,;dante
3;7;10405;87;"come di paradiso, fu remota;";dante
3;7;10406;88;né ricovrar potiensi, se tu badi;dante
3;7;10407;89;ben sottilmente, per alcuna via,;dante
3;7;10408;90;sanza passar per un di questi guadi:;dante
3;7;10409;91;o che Dio solo per sua cortesia;dante
3;7;10410;92;dimesso avesse, o che l’uom per sé isso;dante
3;7;10411;93;avesse sodisfatto a sua follia.;dante
3;7;10412;94;Ficca mo l’occhio per entro l’abisso;dante
3;7;10413;95;de l’etterno consiglio, quanto puoi;dante
3;7;10414;96;al mio parlar distrettamente fisso.;dante
3;7;10415;97;Non potea l’uomo ne’ termini suoi;dante
3;7;10416;98;mai sodisfar, per non potere ir giuso;dante
3;7;10417;99;con umiltate obedïendo poi,;dante
3;7;10418;100;"quanto disobediendo intese ir suso;";dante
3;7;10419;101;e questa è la cagion per che l’uom fue;dante
3;7;10420;102;da poter sodisfar per sé dischiuso.;dante
3;7;10421;103;Dunque a Dio convenia con le vie sue;dante
3;7;10422;104;riparar l’omo a sua intera vita,;dante
3;7;10423;105;dico con l’una, o ver con amendue.;dante
3;7;10424;106;Ma perché l’ovra tanto è più gradita;dante
3;7;10425;107;da l’operante, quanto più appresenta;dante
3;7;10426;108;de la bontà del core ond’ ell’ è uscita,;dante
3;7;10427;109;la divina bontà che ’l mondo imprenta,;dante
3;7;10428;110;di proceder per tutte le sue vie,;dante
3;7;10429;111;a rilevarvi suso, fu contenta.;dante
3;7;10430;112;Né tra l’ultima notte e ’l primo die;dante
3;7;10431;113;sì alto o sì magnifico processo,;dante
3;7;10432;114;o per l’una o per l’altra, fu o fie:;dante
3;7;10433;115;ché più largo fu Dio a dar sé stesso;dante
3;7;10434;116;per far l’uom sufficiente a rilevarsi,;dante
3;7;10435;117;"che s’elli avesse sol da sé dimesso;";dante
3;7;10436;118;e tutti li altri modi erano scarsi;dante
3;7;10437;119;a la giustizia, se ’l Figliuol di Dio;dante
3;7;10438;120;non fosse umilïato ad incarnarsi.;dante
3;7;10439;121;Or per empierti bene ogne disio,;dante
3;7;10440;122;ritorno a dichiararti in alcun loco,;dante
3;7;10441;123;perché tu veggi lì così com’ io.;dante
3;7;10442;124;"Tu dici: ""Io veggio l’acqua, io veggio il foco,";dante
3;7;10443;125;l’aere e la terra e tutte lor misture;dante
3;7;10444;126;"venire a corruzione, e durar poco;";dante
3;7;10445;127;"e queste cose pur furon creature;";dante
3;7;10446;128;per che, se ciò ch’è detto è stato vero,;dante
3;7;10447;129;"esser dovrien da corruzion sicure"".";dante
3;7;10448;130;Li angeli, frate, e ’l paese sincero;dante
3;7;10449;131;nel qual tu se’, dir si posson creati,;dante
3;7;10450;132;"sì come sono, in loro essere intero;";dante
3;7;10451;133;ma li alimenti che tu hai nomati;dante
3;7;10452;134;e quelle cose che di lor si fanno;dante
3;7;10453;135;da creata virtù sono informati.;dante
3;7;10454;136;"Creata fu la materia ch’elli hanno;";dante
3;7;10455;137;creata fu la virtù informante;dante
3;7;10456;138;in queste stelle che ’ntorno a lor vanno.;dante
3;7;10457;139;L’anima d’ogne bruto e de le piante;dante
3;7;10458;140;di complession potenzïata tira;dante
3;7;10459;141;"lo raggio e ’l moto de le luci sante;";dante
3;7;10460;142;ma vostra vita sanza mezzo spira;dante
3;7;10461;143;la somma beninanza, e la innamora;dante
3;7;10462;144;di sé sì che poi sempre la disira.;dante
3;7;10463;145;E quinci puoi argomentare ancora;dante
3;7;10464;146;vostra resurrezion, se tu ripensi;dante
3;7;10465;147;come l’umana carne fessi allora;dante
3;7;10466;148;che li primi parenti intrambo fensi».;dante
3;8;10467;1;Solea creder lo mondo in suo periclo;dante
3;8;10468;2;che la bella Ciprigna il folle amore;dante
3;8;10469;3;"raggiasse, volta nel terzo epiciclo;";dante
3;8;10470;4;per che non pur a lei faceano onore;dante
3;8;10471;5;di sacrificio e di votivo grido;dante
3;8;10472;6;"le genti antiche ne l’antico errore;";dante
3;8;10473;7;ma Dïone onoravano e Cupido,;dante
3;8;10474;8;quella per madre sua, questo per figlio,;dante
3;8;10475;9;"e dicean ch’el sedette in grembo a Dido;";dante
3;8;10476;10;e da costei ond’ io principio piglio;dante
3;8;10477;11;pigliavano il vocabol de la stella;dante
3;8;10478;12;che ’l sol vagheggia or da coppa or da ciglio.;dante
3;8;10479;13;"Io non m’accorsi del salire in ella;";dante
3;8;10480;14;ma d’esservi entro mi fé assai fede;dante
3;8;10481;15;la donna mia ch’i’ vidi far più bella.;dante
3;8;10482;16;E come in fiamma favilla si vede,;dante
3;8;10483;17;e come in voce voce si discerne,;dante
3;8;10484;18;quand’ una è ferma e altra va e riede,;dante
3;8;10485;19;vid’ io in essa luce altre lucerne;dante
3;8;10486;20;muoversi in giro più e men correnti,;dante
3;8;10487;21;al modo, credo, di lor viste interne.;dante
3;8;10488;22;Di fredda nube non disceser venti,;dante
3;8;10489;23;o visibili o no, tanto festini,;dante
3;8;10490;24;che non paressero impediti e lenti;dante
3;8;10491;25;a chi avesse quei lumi divini;dante
3;8;10492;26;veduti a noi venir, lasciando il giro;dante
3;8;10493;27;"pria cominciato in li alti Serafini;";dante
3;8;10494;28;e dentro a quei che più innanzi appariro;dante
3;8;10495;29;sonava ’Osanna’ sì, che unque poi;dante
3;8;10496;30;di rïudir non fui sanza disiro.;dante
3;8;10497;31;Indi si fece l’un più presso a noi;dante
3;8;10498;32;e solo incominciò: «Tutti sem presti;dante
3;8;10499;33;al tuo piacer, perché di noi ti gioi.;dante
3;8;10500;34;Noi ci volgiam coi principi celesti;dante
3;8;10501;35;d’un giro e d’un girare e d’una sete,;dante
3;8;10502;36;ai quali tu del mondo già dicesti:;dante
3;8;10503;37;"’Voi che ’ntendendo il terzo ciel movete’;";dante
3;8;10504;38;e sem sì pien d’amor, che, per piacerti,;dante
3;8;10505;39;non fia men dolce un poco di quïete».;dante
3;8;10506;40;Poscia che li occhi miei si fuoro offerti;dante
3;8;10507;41;a la mia donna reverenti, ed essa;dante
3;8;10508;42;fatti li avea di sé contenti e certi,;dante
3;8;10509;43;rivolsersi a la luce che promessa;dante
3;8;10510;44;tanto s’avea, e «Deh, chi siete?» fue;dante
3;8;10511;45;la voce mia di grande affetto impressa.;dante
3;8;10512;46;E quanta e quale vid’ io lei far piùe;dante
3;8;10513;47;per allegrezza nova che s’accrebbe,;dante
3;8;10514;48;quando parlai, a l’allegrezze sue!;dante
3;8;10515;49;Così fatta, mi disse: «Il mondo m’ebbe;dante
3;8;10516;50;"giù poco tempo; e se più fosse stato,";dante
3;8;10517;51;molto sarà di mal, che non sarebbe.;dante
3;8;10518;52;La mia letizia mi ti tien celato;dante
3;8;10519;53;che mi raggia dintorno e mi nasconde;dante
3;8;10520;54;quasi animal di sua seta fasciato.;dante
3;8;10521;55;"Assai m’amasti, e avesti ben onde;";dante
3;8;10522;56;che s’io fossi giù stato, io ti mostrava;dante
3;8;10523;57;di mio amor più oltre che le fronde.;dante
3;8;10524;58;Quella sinistra riva che si lava;dante
3;8;10525;59;di Rodano poi ch’è misto con Sorga,;dante
3;8;10526;60;per suo segnore a tempo m’aspettava,;dante
3;8;10527;61;e quel corno d’Ausonia che s’imborga;dante
3;8;10528;62;di Bari e di Gaeta e di Catona,;dante
3;8;10529;63;da ove Tronto e Verde in mare sgorga.;dante
3;8;10530;64;Fulgeami già in fronte la corona;dante
3;8;10531;65;di quella terra che ’l Danubio riga;dante
3;8;10532;66;poi che le ripe tedesche abbandona.;dante
3;8;10533;67;E la bella Trinacria, che caliga;dante
3;8;10534;68;tra Pachino e Peloro, sopra ’l golfo;dante
3;8;10535;69;che riceve da Euro maggior briga,;dante
3;8;10536;70;non per Tifeo ma per nascente solfo,;dante
3;8;10537;71;attesi avrebbe li suoi regi ancora,;dante
3;8;10538;72;nati per me di Carlo e di Ridolfo,;dante
3;8;10539;73;se mala segnoria, che sempre accora;dante
3;8;10540;74;li popoli suggetti, non avesse;dante
3;8;10541;75;"mosso Palermo a gridar: ""Mora, mora!"".}}";dante
3;8;10542;76;E se mio frate questo antivedesse,;dante
3;8;10543;77;l’avara povertà di Catalogna;dante
3;8;10544;78;"già fuggeria, perché non li offendesse;";dante
3;8;10545;79;ché veramente proveder bisogna;dante
3;8;10546;80;per lui, o per altrui, sì ch’a sua barca;dante
3;8;10547;81;carcata più d’incarco non si pogna.;dante
3;8;10548;82;La sua natura, che di larga parca;dante
3;8;10549;83;discese, avria mestier di tal milizia;dante
3;8;10550;84;che non curasse di mettere in arca».;dante
3;8;10551;85;«Però ch’i’ credo che l’alta letizia;dante
3;8;10552;86;che ’l tuo parlar m’infonde, segnor mio,;dante
3;8;10553;87;là ’ve ogne ben si termina e s’inizia,;dante
3;8;10554;88;per te si veggia come la vegg’ io,;dante
3;8;10555;89;"grata m’è più; e anco quest’ ho caro";dante
3;8;10556;90;perché ’l discerni rimirando in Dio.;dante
3;8;10557;91;Fatto m’hai lieto, e così mi fa chiaro,;dante
3;8;10558;92;poi che, parlando, a dubitar m’hai mosso;dante
3;8;10559;93;com’ esser può, di dolce seme, amaro».;dante
3;8;10560;94;"Questo io a lui; ed elli a me: «S’io posso";dante
3;8;10561;95;mostrarti un vero, a quel che tu dimandi;dante
3;8;10562;96;terrai lo viso come tien lo dosso.;dante
3;8;10563;97;Lo ben che tutto il regno che tu scandi;dante
3;8;10564;98;volge e contenta, fa esser virtute;dante
3;8;10565;99;sua provedenza in questi corpi grandi.;dante
3;8;10566;100;E non pur le nature provedute;dante
3;8;10567;101;sono in la mente ch’è da sé perfetta,;dante
3;8;10568;102;ma esse insieme con la lor salute:;dante
3;8;10569;103;per che quantunque quest’ arco saetta;dante
3;8;10570;104;disposto cade a proveduto fine,;dante
3;8;10571;105;sì come cosa in suo segno diretta.;dante
3;8;10572;106;Se ciò non fosse, il ciel che tu cammine;dante
3;8;10573;107;producerebbe sì li suoi effetti,;dante
3;8;10574;108;"che non sarebbero arti, ma ruine;";dante
3;8;10575;109;e ciò esser non può, se li ’ntelletti;dante
3;8;10576;110;che muovon queste stelle non son manchi,;dante
3;8;10577;111;e manco il primo, che non li ha perfetti.;dante
3;8;10578;112;Vuo’ tu che questo ver più ti s’imbianchi?».;dante
3;8;10579;113;"E io: «Non già; ché impossibil veggio";dante
3;8;10580;114;che la natura, in quel ch’è uopo, stanchi».;dante
3;8;10581;115;Ond’ elli ancora: «Or dì: sarebbe il peggio;dante
3;8;10582;116;per l’omo in terra, se non fosse cive?».;dante
3;8;10583;117;"«Sì», rispuos’ io; «e qui ragion non cheggio».";dante
3;8;10584;118;«E puot’ elli esser, se giù non si vive;dante
3;8;10585;119;diversamente per diversi offici?;dante
3;8;10586;120;Non, se ’l maestro vostro ben vi scrive».;dante
3;8;10587;121;"Sì venne deducendo infino a quici;";dante
3;8;10588;122;poscia conchiuse: «Dunque esser diverse;dante
3;8;10589;123;convien di vostri effetti le radici:;dante
3;8;10590;124;per ch’un nasce Solone e altro Serse,;dante
3;8;10591;125;altro Melchisedèch e altro quello;dante
3;8;10592;126;che, volando per l’aere, il figlio perse.;dante
3;8;10593;127;La circular natura, ch’è suggello;dante
3;8;10594;128;a la cera mortal, fa ben sua arte,;dante
3;8;10595;129;ma non distingue l’un da l’altro ostello.;dante
3;8;10596;130;Quinci addivien ch’Esaù si diparte;dante
3;8;10597;131;"per seme da Iacòb; e vien Quirino";dante
3;8;10598;132;da sì vil padre, che si rende a Marte.;dante
3;8;10599;133;Natura generata il suo cammino;dante
3;8;10600;134;simil farebbe sempre a’ generanti,;dante
3;8;10601;135;se non vincesse il proveder divino.;dante
3;8;10602;136;Or quel che t’era dietro t’è davanti:;dante
3;8;10603;137;ma perché sappi che di te mi giova,;dante
3;8;10604;138;un corollario voglio che t’ammanti.;dante
3;8;10605;139;Sempre natura, se fortuna trova;dante
3;8;10606;140;discorde a sé, com’ ogne altra semente;dante
3;8;10607;141;fuor di sua regïon, fa mala prova.;dante
3;8;10608;142;E se ’l mondo là giù ponesse mente;dante
3;8;10609;143;al fondamento che natura pone,;dante
3;8;10610;144;seguendo lui, avria buona la gente.;dante
3;8;10611;145;Ma voi torcete a la religïone;dante
3;8;10612;146;tal che fia nato a cignersi la spada,;dante
3;8;10613;147;"e fate re di tal ch’è da sermone;";dante
3;8;10614;148;onde la traccia vostra è fuor di strada».;dante
3;9;10615;1;Da poi che Carlo tuo, bella Clemenza,;dante
3;9;10616;2;m’ebbe chiarito, mi narrò li ’nganni;dante
3;9;10617;3;"che ricever dovea la sua semenza;";dante
3;9;10618;4;"ma disse: «Taci e lascia muover li anni»;";dante
3;9;10619;5;sì ch’io non posso dir se non che pianto;dante
3;9;10620;6;giusto verrà di retro ai vostri danni.;dante
3;9;10621;7;E già la vita di quel lume santo;dante
3;9;10622;8;rivolta s’era al Sol che la rïempie;dante
3;9;10623;9;come quel ben ch’a ogne cosa è tanto.;dante
3;9;10624;10;Ahi anime ingannate e fatture empie,;dante
3;9;10625;11;che da sì fatto ben torcete i cuori,;dante
3;9;10626;12;drizzando in vanità le vostre tempie!;dante
3;9;10627;13;Ed ecco un altro di quelli splendori;dante
3;9;10628;14;ver’ me si fece, e ’l suo voler piacermi;dante
3;9;10629;15;significava nel chiarir di fori.;dante
3;9;10630;16;Li occhi di Bëatrice, ch’eran fermi;dante
3;9;10631;17;sovra me, come pria, di caro assenso;dante
3;9;10632;18;al mio disio certificato fermi.;dante
3;9;10633;19;«Deh, metti al mio voler tosto compenso,;dante
3;9;10634;20;beato spirto», dissi, «e fammi prova;dante
3;9;10635;21;ch’i’ possa in te refletter quel ch’io penso!».;dante
3;9;10636;22;Onde la luce che m’era ancor nova,;dante
3;9;10637;23;del suo profondo, ond’ ella pria cantava,;dante
3;9;10638;24;seguette come a cui di ben far giova:;dante
3;9;10639;25;«In quella parte de la terra prava;dante
3;9;10640;26;italica che siede tra Rïalto;dante
3;9;10641;27;e le fontane di Brenta e di Piava,;dante
3;9;10642;28;si leva un colle, e non surge molt’ alto,;dante
3;9;10643;29;là onde scese già una facella;dante
3;9;10644;30;che fece a la contrada un grande assalto.;dante
3;9;10645;31;D’una radice nacqui e io ed ella:;dante
3;9;10646;32;Cunizza fui chiamata, e qui refulgo;dante
3;9;10647;33;"perché mi vinse il lume d’esta stella;";dante
3;9;10648;34;ma lietamente a me medesma indulgo;dante
3;9;10649;35;"la cagion di mia sorte, e non mi noia;";dante
3;9;10650;36;che parria forse forte al vostro vulgo.;dante
3;9;10651;37;Di questa luculenta e cara gioia;dante
3;9;10652;38;del nostro cielo che più m’è propinqua,;dante
3;9;10653;39;"grande fama rimase; e pria che moia,";dante
3;9;10654;40;questo centesimo anno ancor s’incinqua:;dante
3;9;10655;41;vedi se far si dee l’omo eccellente,;dante
3;9;10656;42;sì ch’altra vita la prima relinqua.;dante
3;9;10657;43;E ciò non pensa la turba presente;dante
3;9;10658;44;che Tagliamento e Adice richiude,;dante
3;9;10659;45;"né per esser battuta ancor si pente;";dante
3;9;10660;46;ma tosto fia che Padova al palude;dante
3;9;10661;47;cangerà l’acqua che Vincenza bagna,;dante
3;9;10662;48;"per essere al dover le genti crude;";dante
3;9;10663;49;e dove Sile e Cagnan s’accompagna,;dante
3;9;10664;50;tal signoreggia e va con la testa alta,;dante
3;9;10665;51;che già per lui carpir si fa la ragna.}};dante
3;9;10666;52;Piangerà Feltro ancora la difalta;dante
3;9;10667;53;de l’empio suo pastor, che sarà sconcia;dante
3;9;10668;54;sì, che per simil non s’entrò in malta.;dante
3;9;10669;55;Troppo sarebbe larga la bigoncia;dante
3;9;10670;56;che ricevesse il sangue ferrarese,;dante
3;9;10671;57;e stanco chi ’l pesasse a oncia a oncia,;dante
3;9;10672;58;che donerà questo prete cortese;dante
3;9;10673;59;"per mostrarsi di parte; e cotai doni";dante
3;9;10674;60;conformi fieno al viver del paese.;dante
3;9;10675;61;Sù sono specchi, voi dicete Troni,;dante
3;9;10676;62;"onde refulge a noi Dio giudicante;";dante
3;9;10677;63;sì che questi parlar ne paion buoni».;dante
3;9;10678;64;"Qui si tacette; e fecemi sembiante";dante
3;9;10679;65;che fosse ad altro volta, per la rota;dante
3;9;10680;66;in che si mise com’ era davante.;dante
3;9;10681;67;L’altra letizia, che m’era già nota;dante
3;9;10682;68;per cara cosa, mi si fece in vista;dante
3;9;10683;69;qual fin balasso in che lo sol percuota.;dante
3;9;10684;70;Per letiziar là sù fulgor s’acquista,;dante
3;9;10685;71;"sì come riso qui; ma giù s’abbuia";dante
3;9;10686;72;l’ombra di fuor, come la mente è trista.;dante
3;9;10687;73;«Dio vede tutto, e tuo veder s’inluia»,;dante
3;9;10688;74;diss’ io, «beato spirto, sì che nulla;dante
3;9;10689;75;voglia di sé a te puot’ esser fuia.;dante
3;9;10690;76;Dunque la voce tua, che ’l ciel trastulla;dante
3;9;10691;77;sempre col canto di quei fuochi pii;dante
3;9;10692;78;che di sei ali facen la coculla,;dante
3;9;10693;79;perché non satisface a’ miei disii?;dante
3;9;10694;80;Già non attendere’ io tua dimanda,;dante
3;9;10695;81;s’io m’intuassi, come tu t’inmii».;dante
3;9;10696;82;«La maggior valle in che l’acqua si spanda»,;dante
3;9;10697;83;incominciaro allor le sue parole,;dante
3;9;10698;84;«fuor di quel mar che la terra inghirlanda,;dante
3;9;10699;85;tra ’ discordanti liti contra ’l sole;dante
3;9;10700;86;tanto sen va, che fa meridïano;dante
3;9;10701;87;là dove l’orizzonte pria far suole.;dante
3;9;10702;88;Di quella valle fu’ io litorano;dante
3;9;10703;89;tra Ebro e Macra, che per cammin corto;dante
