cantica;canto;start_verse;end_verse;text;author;type
Inferno;33;142;147;Alberigo: but his and his kinsman’s souls are here;hollander;outline
Inferno;33;148;150;"Again Alberigo asks for aid; Dante does not give it";hollander;outline
Inferno;33;151;157;Apostrophe of Genoa;hollander;outline
Inferno;34;1;3;Virgil’s Latin beginning;hollander;outline
Inferno;34;4;7;Simile: mill seen through fog or twilight;hollander;outline
Inferno;34;8;9;Dante retreats behind Virgil to escape the wind;hollander;outline
Inferno;34;10;15;The souls here are completely covered by ice;hollander;outline
Inferno;34;16;21;Virgil announces Satan and encourages Dante;hollander;outline
Inferno;34;22;27;The seventh address to the reader in *Inferno*;hollander;outline
Inferno;34;28;36;Lucifer: his size, his ugliness;hollander;outline
Inferno;34;37;45;His three-faced head: white-yellow (Cassius), red (Judas), black (Brutus);hollander;outline
Inferno;34;46;52;His six wings, congealing Cocytus;hollander;outline
Inferno;34;53;54;Tears from his six eyes mix with blood at his chins;hollander;outline
Inferno;34;55;60;"Each of his three jaws chews a sinner; with his talons he flays the one in the center";hollander;outline
Inferno;34;61;67;Virgil identifies Judas, Brutus, and Cassius;hollander;outline
Inferno;34;68;69;Virgil: it is time to depart, we have seen it all;hollander;outline
Inferno;34;70;81;"Dante attaches himself to Virgil; they turn around";hollander;outline
Inferno;34;82;84;Virgil’s encouragement: “hold fast”;hollander;outline
Inferno;34;85;93;"Arrival at a ledge; Dante sees Lucifer’s legs above";hollander;outline
Inferno;34;94;96;Virgil: it is already 7:30 AM Saturday;hollander;outline
Inferno;34;97;105;Dante’s three questions: (1) Where’s the ice? (2) Why is Lucifer upside down? (3) How is it already morning?;hollander;outline
Inferno;34;106;126;"Virgil’s responses: (1) Behind us; (3) Because of where we are; (2) Lucifer’s fall";hollander;outline
Inferno;34;127;132;A watercourse leads them gently upward;hollander;outline
Inferno;34;133;139;They return to earth, under heaven;hollander;outline
